{
  "description": "Exact evaluator census over the authoritative exploded representation (gate 8 evidence): scan all records, sorted by record_id.",
  "nodes": [
    {
      "id": "r",
      "op": "read",
      "source": "records"
    },
    {
      "by": [
        "record_id"
      ],
      "id": "s",
      "input": "r",
      "op": "sort"
    }
  ],
  "query_id": "solqry-record-census",
  "root": "s",
  "schema_version": "qry.query.v0.3",
  "sources": {
    "records": {
      "artifact": {
        "digest": "object:sha256:4519e5fe21b4d163202af69dcf770516815428796fe0896248cc65fda02894d8",
        "path": "sol_validator/corpus/PATH-004/artifact.sol.d",
        "relation": "records"
      },
      "schema": [
        {
          "name": "record_id",
          "nullable": true,
          "type": "string"
        },
        {
          "name": "record_type",
          "nullable": true,
          "type": "string"
        },
        {
          "name": "lifecycle",
          "nullable": true,
          "path": "status.lifecycle",
          "type": "string"
        },
        {
          "name": "staleness",
          "nullable": true,
          "path": "status.staleness",
          "type": "string"
        },
        {
          "name": "verification",
          "nullable": true,
          "path": "status.verification",
          "type": "string"
        }
      ]
    }
  }
}
